{
  "schema": "agentswitchboard.technician-live-cert-manifest.v1",
  "manifestVersion": 1,
  "stages": [
    {
      "stageId": "P00",
      "name": "Preflight",
      "cmd": "Technician-LiveCert-P00-Preflight.cmd",
      "implementation": "stages/P00-Preflight.ps1",
      "requiresElevation": false,
      "requiresNetwork": false,
      "mutatesWorkstation": false,
      "optional": false,
      "dependencies": [],
      "manualObservationRequired": false,
      "evidenceArtifacts": ["stage-P00.json", "preflight/"]
    },
    {
      "stageId": "P01",
      "name": "Network Reachability",
      "cmd": "Technician-LiveCert-P01-Network.cmd",
      "implementation": "stages/P01-Network.ps1",
      "requiresElevation": false,
      "requiresNetwork": true,
      "mutatesWorkstation": false,
      "optional": false,
      "dependencies": ["P00"],
      "manualObservationRequired": false,
      "evidenceArtifacts": ["stage-P01.json", "network/"]
    },
    {
      "stageId": "P02",
      "name": "Pull and Setup",
      "cmd": "Technician-LiveCert-P02-Pull-And-Setup.cmd",
      "implementation": "stages/P02-Pull-And-Setup.ps1",
      "requiresElevation": true,
      "requiresNetwork": true,
      "mutatesWorkstation": true,
      "optional": false,
      "dependencies": ["P00", "P01"],
      "manualObservationRequired": false,
      "evidenceArtifacts": ["stage-P02.json", "setup/"]
    },
    {
      "stageId": "P03",
      "name": "Verify Commands",
      "cmd": "Technician-LiveCert-P03-Verify-Commands.cmd",
      "implementation": "stages/P03-Verify-Commands.ps1",
      "requiresElevation": false,
      "requiresNetwork": false,
      "mutatesWorkstation": false,
      "optional": false,
      "dependencies": ["P02"],
      "manualObservationRequired": false,
      "evidenceArtifacts": ["stage-P03.json", "commands/"]
    },
    {
      "stageId": "P04",
      "name": "Launch Shell",
      "cmd": "Technician-LiveCert-P04-Launch-Shell.cmd",
      "implementation": "stages/P04-Launch-Shell.ps1",
      "requiresElevation": false,
      "requiresNetwork": false,
      "mutatesWorkstation": false,
      "optional": false,
      "dependencies": ["P00", "P02", "P03"],
      "manualObservationRequired": true,
      "evidenceArtifacts": ["stage-P04.json", "launcher/"]
    },
    {
      "stageId": "P05",
      "name": "Launch AGY",
      "cmd": "Technician-LiveCert-P05-Launch-AGY.cmd",
      "implementation": "stages/P05-Launch-AGY.ps1",
      "requiresElevation": false,
      "requiresNetwork": true,
      "mutatesWorkstation": false,
      "optional": false,
      "dependencies": ["P04"],
      "manualObservationRequired": true,
      "evidenceArtifacts": ["stage-P05.json", "agy/"]
    },
    {
      "stageId": "P06",
      "name": "Launch OpenCode",
      "cmd": "Technician-LiveCert-P06-Launch-OpenCode.cmd",
      "implementation": "stages/P06-Launch-OpenCode.ps1",
      "requiresElevation": false,
      "requiresNetwork": true,
      "mutatesWorkstation": false,
      "optional": false,
      "dependencies": ["P04"],
      "manualObservationRequired": true,
      "evidenceArtifacts": ["stage-P06.json", "opencode/"]
    },
    {
      "stageId": "P07",
      "name": "Repeatability",
      "cmd": "Technician-LiveCert-P07-Repeatability.cmd",
      "implementation": "stages/P07-Repeatability.ps1",
      "requiresElevation": false,
      "requiresNetwork": false,
      "mutatesWorkstation": false,
      "optional": false,
      "dependencies": ["P02", "P04", "P05", "P06"],
      "manualObservationRequired": true,
      "evidenceArtifacts": ["stage-P07.json", "repeatability/"]
    },
    {
      "stageId": "P08",
      "name": "Finalize",
      "cmd": "Technician-LiveCert-P08-Finalize.cmd",
      "implementation": "stages/P08-Finalize.ps1",
      "requiresElevation": false,
      "requiresNetwork": false,
      "mutatesWorkstation": false,
      "optional": false,
      "dependencies": ["P07"],
      "manualObservationRequired": false,
      "evidenceArtifacts": ["stage-P08.json", "final/", "technician-live-cert-summary.json", "technician-live-cert-report.md", "technician-live-cert-stage-matrix.csv", "technician-live-cert-handoff.txt"]
    },
    {
      "stageId": "P09",
      "name": "Hermes Optional",
      "cmd": "Technician-LiveCert-P09-Hermes-Optional.cmd",
      "implementation": "stages/P09-Hermes-Optional.ps1",
      "requiresElevation": true,
      "requiresNetwork": true,
      "mutatesWorkstation": true,
      "optional": true,
      "dependencies": ["P08"],
      "manualObservationRequired": true,
      "evidenceArtifacts": ["stage-P09.json", "hermes/"]
    }
  ],
  "coreSequence": ["P00", "P01", "P02", "P03", "P04", "P05", "P06", "P07", "P08"],
  "repairs": [
    {
      "repairId": "WSL-Ubuntu",
      "name": "Repair WSL Ubuntu",
      "cmd": "Repair-Technician-WSL-Ubuntu.cmd",
      "implementation": "stages/Repair-Technician-WSL-Ubuntu.ps1",
      "requiresElevation": true,
      "requiresNetwork": true,
      "targetsStages": ["P00", "P02"]
    },
    {
      "repairId": "WezTerm",
      "name": "Repair WezTerm",
      "cmd": "Repair-Technician-WezTerm.cmd",
      "implementation": "stages/Repair-Technician-WezTerm.ps1",
      "requiresElevation": true,
      "requiresNetwork": true,
      "targetsStages": ["P00", "P02", "P03", "P04"]
    },
    {
      "repairId": "AGY",
      "name": "Repair AGY",
      "cmd": "Repair-Technician-AGY.cmd",
      "implementation": "stages/Repair-Technician-AGY.ps1",
      "requiresElevation": false,
      "requiresNetwork": true,
      "targetsStages": ["P02", "P03", "P05"]
    },
    {
      "repairId": "OpenCode",
      "name": "Repair OpenCode",
      "cmd": "Repair-Technician-OpenCode.cmd",
      "implementation": "stages/Repair-Technician-OpenCode.ps1",
      "requiresElevation": false,
      "requiresNetwork": true,
      "targetsStages": ["P02", "P03", "P06"]
    },
    {
      "repairId": "Command-Shims",
      "name": "Repair Command Shims",
      "cmd": "Repair-Technician-Command-Shims.cmd",
      "implementation": "stages/Repair-Technician-Command-Shims.ps1",
      "requiresElevation": false,
      "requiresNetwork": false,
      "targetsStages": ["P03", "P04", "P05", "P06"]
    }
  ],
  "fullRunCmd": "Run-Technician-LiveCert.cmd",
  "bootstrapCmd": "AgentSwitchboard-Technician-Bootstrap.cmd"
}